{
  "$schema": "../../registries/operating-model/instance-canonical-export.schema.json",
  "schema_version": 1,
  "registry_id": "instance-canonical-export",
  "title": "Sample frozen-Instance canonical export",
  "exports": [
    {
      "$schema": "registries/operating-model/scoped-record.schema.json",
      "schema_version": 1,
      "id": "sample-frozen-instance-export",
      "title": "Sample canonical export",
      "record_type": "instance-canonical-export",
      "scope": {
        "type": "project-workspace",
        "id": "sample"
      },
      "origin": {
        "kind": "derived",
        "source_ref": "migration-plan:sample-frozen-instance-plan"
      },
      "authority": {
        "kind": "delegated-run",
        "authority_ref": "instance-canonical-export-run:sample-frozen-instance-export"
      },
      "payload": {
        "plan_ref": "sample-frozen-instance-plan",
        "plan_fingerprint": "8b199bdf463929fe4b932bd35993e6d972cf46c168b3e5d31af12f3507a8570d",
        "source": {
          "repository_ref": "sample-frozen-instance",
          "revision": "8b82b86238dc6b47dd578067c564e332e9c06fa8",
          "digest": {
            "algorithm": "sha-256",
            "value": "fb6627013317038e5d96d8a5cf39c7518ec4fb048a414c203e1be1c3d617821d"
          }
        },
        "records": [
          {
            "$schema": "registries/operating-model/scoped-record.schema.json",
            "id": "notes-readme-txt",
            "title": "notes/readme.txt",
            "record_type": "workspace-file",
            "scope": {
              "type": "project-workspace",
              "id": "sample"
            },
            "schema_version": 1,
            "origin": {
              "kind": "migrated",
              "source_ref": "record-unit:notes-readme-txt"
            },
            "authority": {
              "kind": "project-owner",
              "authority_ref": "sample-owner",
              "decision_ref": "owner-decision:sample-frozen-instance-migration"
            },
            "payload": {
              "media_type": "text/plain",
              "encoding": "utf-8",
              "content": "# Sample notes\r\n\r\nA carrier kept byte for byte, CRLF included.\r\n",
              "digest": {
                "algorithm": "sha-256",
                "value": "6b2f8664142adac3c9981db33ae9e609fc4ffb51e93a18b0df779fce15a2deef"
              }
            }
          },
          {
            "$schema": "registries/operating-model/scoped-record.schema.json",
            "id": "inventory-items-alpha",
            "title": "Item alpha",
            "record_type": "inventory-item",
            "scope": {
              "type": "project-workspace",
              "id": "sample"
            },
            "schema_version": 1,
            "origin": {
              "kind": "migrated",
              "source_ref": "record-unit:inventory-items-alpha"
            },
            "authority": {
              "kind": "project-owner",
              "authority_ref": "sample-owner",
              "decision_ref": "owner-decision:sample-frozen-instance-migration"
            },
            "payload": {
              "media_type": "application/json",
              "encoding": "utf-8",
              "content": "{\"id\":\"alpha\",\"size\":1,\"tags\":[\"first\"]}",
              "digest": {
                "algorithm": "sha-256",
                "value": "45a974f5385f7450d90f42f691efdc6ea51e0294264cf97eee1cb3a9107fc3b3"
              }
            }
          },
          {
            "$schema": "registries/operating-model/scoped-record.schema.json",
            "id": "inventory-items-beta-gamma",
            "title": "Item beta gamma",
            "record_type": "versioning-conformance-case",
            "scope": {
              "type": "project-workspace",
              "id": "sample"
            },
            "schema_version": 1,
            "origin": {
              "kind": "migrated",
              "source_ref": "record-unit:inventory-items-beta-gamma"
            },
            "authority": {
              "kind": "project-owner",
              "authority_ref": "sample-owner",
              "decision_ref": "owner-decision:sample-frozen-instance-migration"
            },
            "payload": {
              "media_type": "application/json",
              "encoding": "utf-8",
              "content": "{\"id\":\"beta gamma\",\"size\":2}",
              "digest": {
                "algorithm": "sha-256",
                "value": "1fd733274a3d997038efa14df7bcafc7f25d8376cc05f49b6c3abb21fdb14b86"
              }
            }
          },
          {
            "$schema": "registries/operating-model/scoped-record.schema.json",
            "id": "rule-applicability-0",
            "title": "Applicability of AGENTS.md#operational-roles",
            "record_type": "rule-applicability-record",
            "scope": {
              "type": "repository-scope",
              "id": "sample-repo",
              "workspace_id": "sample"
            },
            "schema_version": 1,
            "origin": {
              "kind": "migrated",
              "source_ref": "record-unit:rule-applicability-0"
            },
            "authority": {
              "kind": "repository-maintainer",
              "authority_ref": "sample-owner",
              "decision_ref": "owner-decision:sample-frozen-instance-migration"
            },
            "payload": {
              "media_type": "application/json",
              "encoding": "utf-8",
              "content": "{\"activation\":\"always\",\"digest\":\"013e7155d519b0a183ad8bd70395ff7fd910939f2b7f5cb797a332c855e9d57b\",\"intake_record\":{\"recorded_at\":\"2026-01-01\",\"register\":\"instruction-intake/sample-repo.yaml\",\"verdict\":\"keep-local\"},\"norm\":{\"path\":\"AGENTS.md\",\"region\":\"operational-roles\",\"repository\":\"sample-repo\"},\"recorded_at\":\"2026-01-02\",\"repository\":\"sample-repo\",\"scope\":\"repository\",\"source\":\"repository\",\"status\":\"resolved\"}",
              "digest": {
                "algorithm": "sha-256",
                "value": "7c5ea2ec49e157ed752bddb8b7996da15c06a2cd10836197a57cfd56c4c9eb5d"
              }
            }
          },
          {
            "$schema": "registries/operating-model/scoped-record.schema.json",
            "id": "rule-applicability-1",
            "title": "Applicability of AGENTS.md#repository-context",
            "record_type": "rule-applicability-record",
            "scope": {
              "type": "repository-scope",
              "id": "sample-repo",
              "workspace_id": "sample"
            },
            "schema_version": 1,
            "origin": {
              "kind": "migrated",
              "source_ref": "record-unit:rule-applicability-1"
            },
            "authority": {
              "kind": "repository-maintainer",
              "authority_ref": "sample-owner",
              "decision_ref": "owner-decision:sample-frozen-instance-migration"
            },
            "payload": {
              "media_type": "application/json",
              "encoding": "utf-8",
              "content": "{\"activation\":\"path-glob\",\"digest\":\"cc5463dc3a765c3cedc18af3544063dd119ce25ae1b849537bfb360b4a0aebb1\",\"globs\":[\"src/**\",\"docs/**\"],\"intake_record\":{\"recorded_at\":\"2026-01-01\",\"register\":\"instruction-intake/sample-repo.yaml\",\"verdict\":\"keep-local\"},\"norm\":{\"path\":\"AGENTS.md\",\"region\":\"repository-context\",\"repository\":\"sample-repo\"},\"recorded_at\":\"2026-01-02\",\"repository\":\"sample-repo\",\"scope\":\"repository\",\"source\":\"repository\",\"status\":\"resolved\"}",
              "digest": {
                "algorithm": "sha-256",
                "value": "866e56c180db396a7e1fe5b361142ca62d6d7f945d1bb12b09d39336bba035a4"
              }
            }
          }
        ],
        "retained": [
          {
            "unit_id": "foreign-keep-txt",
            "reason": "foreign content stays transitional until its owner decides"
          }
        ],
        "idempotency_key": "0b4a8bc797fb09a7cdd3e4e20850cd834bf8342e67863f3feb350dc6a02958c0",
        "digest": "22d8d327d97b2b7f6cdabbf00ca2b26948f3924201a6f91c9f4520d920f75197"
      }
    }
  ]
}
